{
  "project_name": {
    "value": "hyder_arizona_staggered_layout",
    "type": "string"
  },
  "location": {
    "latitude": {
      "value": 33.024436,
      "type": "float"
    },
    "longitude": {
      "value": -113.381777,
      "type": "float"
    }
  },
  "data": {
    "dni_file": {
      "value": "data/dni_hyder_arizona.csv",
      "type": "string"
    },
    "directions_with_weights_file": {
      "value": "data/directions_with_weights_hyder_arizona.csv",
      "type": "string"
    }
  },
  "executables": {
    "sampling_exe": {
      "value": "../../build/tools/GenerateSamplingDirectionsAndWeights/Release/GenerateSamplingDirectionsAndWeights",
      "type": "string"
    },
    "tonatiuh_exe": {
      "value": "/home/mblanco/TonatiuhXX-Run/Tonatiuh++",
      "type": "string"
    },
    "energy_exe": {
      "value": "../../build/apps/AnnualEnergy/AnnualEnergy",
      "type": "string"
    }
  },
  "scripts": {
    "tonatiuh_script": {
      "value": "scripts/radial_staggered_north_field.tnhpps",
      "type": "string"
    }
  },
  "folders": {
    "results": {
      "value": "results",
      "type": "string"
    }
  },
  "paths": {
    "workflows_dir": {
      "value": "../../workflows",
      "type": "string"
    }
  },
  "optimization_config": {
    "type": {
      "value": "differential_evolution",
      "type": "string"
    },
    "layout_generator_type": {
      "value": "radial_staggered",
      "type": "string"
    },
    "physical_parameters": {
      "num_heliostats": {
        "value": 6500,
        "type": "int"
      },
      "bubble_radius": {
        "value": 2.4,
        "type": "float"
      },
      "receiver_height": {
        "bounds": [70.0, 90.0],
        "type": "float",
        "optimizable": true
      },
      "flat_receiver_radius": {
        "bounds": [1.0, 2.0],
        "type": "float",
        "optimizable": true
      },
      "flat_receiver_tilt": {
        "value": 0.0,
        "type": "float"
      },
      "min_tower_clearance": {
        "value": 10.0,
        "type": "float"
      },
      "north_only": {
        "value": true,
        "type": "bool"
      }
    },
    "layout_generation_parameters": {
      "d0": {
        "bounds": [4.0, 10.0],
        "type": "float",
        "optimizable": true
      },
      "alpha": {
        "bounds": [0.0, 0.2],
        "type": "float",
        "optimizable": true
      },
      "a0": {
        "bounds": [0.2, 1.0],
        "type": "float",
        "optimizable": true
      },
      "gamma": {
        "bounds": [0.0, 0.02],
        "type": "float",
        "optimizable": true
      }
    },
    "optimization_parameters": {
      "population_size": {
        "value": 10,
        "type": "int"
      },
      "max_generations": {
        "value": 5,
        "type": "int"
      },
      "mutation_factor": {
        "value": 0.8,
        "type": "float"
      },
      "crossover_rate": {
        "value": 0.6,
        "type": "float"
      }
    }
  }
}